[
 {
  "schema": "raphael/lesson/v1",
  "id": "les_01KXSXE9V5RHHFFC8RE0RN2AZW",
  "slug": "secrets-belong-in-env-vars",
  "title": "Keep secrets in environment variables, not source code",
  "status": "candidate",
  "category": "security",
  "severity": "critical",
  "scope": {
   "stacks": [],
   "task_kinds": [],
   "projects": [],
   "agents": [
    "security",
    "reviewer",
    "developer"
   ]
  },
  "triggers": {
   "keywords": [
    "secret",
    "api key",
    "token",
    "credential",
    "env",
    "stripe",
    "supabase",
    "database url"
   ],
   "paths": [
    ".env",
    "config",
    "settings"
   ]
  },
  "lesson": "API keys, tokens, database URLs, and passwords written as string literals in source, config, or comments are exposed the moment the repo is shared or the bundle ships. Every secret lives in an environment variable read at runtime; the source holds names, never values.",
  "evidence": {
   "refs": [],
   "observations": 0,
   "distinct_projects": 0,
   "first_seen": "2026-07-18",
   "last_seen": "2026-07-18"
  },
  "provenance": {
   "created_by": "raphael/security-pack (based on Gitleaks)",
   "source_kind": "imported",
   "human_edited": false,
   "tier": "curated"
  },
  "injection": {
   "headline": "Hardcoded secrets in source leak on share — read them from env vars instead.",
   "tokens": 19
  }
 },
 {
  "schema": "raphael/lesson/v1",
  "id": "les_01KXSXE9VG606Z9D8GZFEC7454",
  "slug": "no-public-prefix-on-secret-env-vars",
  "title": "Never put a secret behind a browser-exposed env prefix",
  "status": "candidate",
  "category": "security",
  "severity": "high",
  "scope": {
   "stacks": [],
   "task_kinds": [],
   "projects": [],
   "agents": [
    "security",
    "reviewer",
    "developer"
   ]
  },
  "triggers": {
   "keywords": [
    "env",
    "frontend",
    "next_public",
    "react_app",
    "vite",
    "browser",
    "client"
   ],
   "paths": []
  },
  "lesson": "Build tools inline any variable prefixed with NEXT_PUBLIC_, REACT_APP_, or VITE_ straight into the browser bundle, where anyone viewing the page can read it. Only genuinely public values take those prefixes; a service-role or secret key behind one is fully exposed.",
  "evidence": {
   "refs": [],
   "observations": 0,
   "distinct_projects": 0,
   "first_seen": "2026-07-18",
   "last_seen": "2026-07-18"
  },
  "provenance": {
   "created_by": "raphael/security-pack (based on Gitleaks)",
   "source_kind": "imported",
   "human_edited": false,
   "tier": "curated"
  },
  "injection": {
   "headline": "A NEXT_PUBLIC_/VITE_ prefix ships the value to the browser — never for secret keys.",
   "tokens": 21
  }
 },
 {
  "schema": "raphael/lesson/v1",
  "id": "les_01KXSXE9VHNYVARZVWVQG11V98",
  "slug": "rotate-secrets-that-touched-git",
  "title": "Rotate any secret that was ever committed to git",
  "status": "candidate",
  "category": "security",
  "severity": "high",
  "scope": {
   "stacks": [],
   "task_kinds": [],
   "projects": [],
   "agents": [
    "security",
    "reviewer",
    "deployer"
   ]
  },
  "triggers": {
   "keywords": [
    "git",
    "history",
    "secret",
    "rotate",
    "commit",
    "leak"
   ],
   "paths": []
  },
  "lesson": "Removing a secret from current code does not remove it from git history, where anyone with the repo can still recover it. A key, token, or password that was ever committed is compromised and stays valid until rotated at its provider.",
  "evidence": {
   "refs": [],
   "observations": 0,
   "distinct_projects": 0,
   "first_seen": "2026-07-18",
   "last_seen": "2026-07-18"
  },
  "provenance": {
   "created_by": "raphael/security-pack (based on Gitleaks)",
   "source_kind": "imported",
   "human_edited": false,
   "tier": "curated"
  },
  "injection": {
   "headline": "Deleting a leaked secret leaves it in git history — rotate it, do not just delete.",
   "tokens": 21
  }
 },
 {
  "schema": "raphael/lesson/v1",
  "id": "les_01KXSXE9VJMS8G1R0CVN8T1AX0",
  "slug": "hash-passwords-with-a-slow-kdf",
  "title": "Store passwords with a slow hash, never plain or fast hashes",
  "status": "candidate",
  "category": "security",
  "severity": "critical",
  "scope": {
   "stacks": [],
   "task_kinds": [],
   "projects": [],
   "agents": [
    "security",
    "reviewer",
    "developer"
   ]
  },
  "triggers": {
   "keywords": [
    "password",
    "hash",
    "bcrypt",
    "argon2",
    "scrypt",
    "auth",
    "login"
   ],
   "paths": []
  },
  "lesson": "Passwords kept in plaintext, or hashed with a fast algorithm like MD5 or SHA-256 alone, fall to offline cracking within hours of a database leak. A purpose-built slow hash — bcrypt, scrypt, or argon2 — is required, and the plaintext is never stored, logged, or returned.",
  "evidence": {
   "refs": [],
   "observations": 0,
   "distinct_projects": 0,
   "first_seen": "2026-07-18",
   "last_seen": "2026-07-18"
  },
  "provenance": {
   "created_by": "raphael/security-pack (based on Bearer)",
   "source_kind": "imported",
   "human_edited": false,
   "tier": "curated"
  },
  "injection": {
   "headline": "Plain or MD5/SHA-256 passwords crack fast after a leak — use bcrypt/scrypt/argon2.",
   "tokens": 21
  }
 },
 {
  "schema": "raphael/lesson/v1",
  "id": "les_01KXSXE9VM6FHPR67GT4G3FJ33",
  "slug": "keep-pii-and-secrets-out-of-logs",
  "title": "Redact personal data and secrets before logging",
  "status": "candidate",
  "category": "security",
  "severity": "high",
  "scope": {
   "stacks": [],
   "task_kinds": [],
   "projects": [],
   "agents": [
    "security",
    "reviewer",
    "developer"
   ]
  },
  "triggers": {
   "keywords": [
    "log",
    "logging",
    "pii",
    "redact",
    "email",
    "observability"
   ],
   "paths": []
  },
  "lesson": "Log lines that include full requests, headers, emails, phone numbers, or tokens copy that sensitive data into log storage and any third-party log service, where it outlives its purpose. Logs carry method, path, and status; sensitive fields are redacted or omitted.",
  "evidence": {
   "refs": [],
   "observations": 0,
   "distinct_projects": 0,
   "first_seen": "2026-07-18",
   "last_seen": "2026-07-18"
  },
  "provenance": {
   "created_by": "raphael/security-pack (based on Bearer)",
   "source_kind": "imported",
   "human_edited": false,
   "tier": "curated"
  },
  "injection": {
   "headline": "Full-request logging copies PII and tokens into log storage — redact before logging.",
   "tokens": 21
  }
 },
 {
  "schema": "raphael/lesson/v1",
  "id": "les_01KXSXE9VNNQVENRWCMRAW2ZJZ",
  "slug": "set-httponly-secure-samesite-cookies",
  "title": "Session cookies need httpOnly, secure, and sameSite",
  "status": "candidate",
  "category": "security",
  "severity": "high",
  "scope": {
   "stacks": [],
   "task_kinds": [],
   "projects": [],
   "agents": [
    "security",
    "reviewer",
    "developer"
   ]
  },
  "triggers": {
   "keywords": [
    "cookie",
    "session",
    "httponly",
    "samesite",
    "xss",
    "csrf",
    "localstorage"
   ],
   "paths": []
  },
  "lesson": "A session cookie without httpOnly is readable by any script through an XSS bug; without secure it crosses plaintext HTTP; without sameSite it rides cross-site requests as CSRF. Session identifiers set all three, and personal data stays out of localStorage, which every script on the page can read.",
  "evidence": {
   "refs": [],
   "observations": 0,
   "distinct_projects": 0,
   "first_seen": "2026-07-18",
   "last_seen": "2026-07-18"
  },
  "provenance": {
   "created_by": "raphael/security-pack (based on Bearer)",
   "source_kind": "imported",
   "human_edited": false,
   "tier": "curated"
  },
  "injection": {
   "headline": "Cookies missing httpOnly/secure/sameSite are stealable — set all three on sessions.",
   "tokens": 21
  }
 },
 {
  "schema": "raphael/lesson/v1",
  "id": "les_01KXSXE9VPR6Q6FVK7JNPP0PYH",
  "slug": "return-only-the-fields-the-client-needs",
  "title": "Filter API responses to the fields the client needs",
  "status": "candidate",
  "category": "security",
  "severity": "high",
  "scope": {
   "stacks": [],
   "task_kinds": [],
   "projects": [],
   "agents": [
    "security",
    "reviewer",
    "developer"
   ]
  },
  "triggers": {
   "keywords": [
    "api",
    "response",
    "serializer",
    "over-fetch",
    "fields",
    "pii"
   ],
   "paths": []
  },
  "lesson": "Returning a whole database record leaks password hashes, internal ids, moderation flags, and sometimes other users data the caller was never meant to see. Each endpoint serializes an explicit allowlist of fields rather than the raw row.",
  "evidence": {
   "refs": [],
   "observations": 0,
   "distinct_projects": 0,
   "first_seen": "2026-07-18",
   "last_seen": "2026-07-18"
  },
  "provenance": {
   "created_by": "raphael/security-pack (based on Bearer)",
   "source_kind": "imported",
   "human_edited": false,
   "tier": "curated"
  },
  "injection": {
   "headline": "Returning whole records leaks hidden fields — serialize an explicit allowlist.",
   "tokens": 20
  }
 },
 {
  "schema": "raphael/lesson/v1",
  "id": "les_01KXSXE9VPVP75PRH9R1QMGQQM",
  "slug": "send-baseline-security-headers",
  "title": "Send the baseline security response headers",
  "status": "candidate",
  "category": "security",
  "severity": "medium",
  "scope": {
   "stacks": [],
   "task_kinds": [],
   "projects": [],
   "agents": [
    "security",
    "reviewer",
    "deployer"
   ]
  },
  "triggers": {
   "keywords": [
    "headers",
    "helmet",
    "csp",
    "hsts",
    "clickjacking",
    "x-frame-options"
   ],
   "paths": []
  },
  "lesson": "Without X-Content-Type-Options, X-Frame-Options, Strict-Transport-Security, and a Content-Security-Policy, an app is open to MIME sniffing, clickjacking, protocol downgrade, and injected scripts. These headers ship on every response; on Express the helmet middleware sets a sound default set.",
  "evidence": {
   "refs": [],
   "observations": 0,